{
  "version": "2.0",
  "machine_type": "hangprinter_4",
  "num_anchors": 4,
  "dimensions": 3,
  "timestamp": "2026-03-23T20:51:13.620678",
  "config": {
    "angles_unit": "deg",
    "lengths_unit": "mm",
    "m666_before_data_collection": {
      "M": 666,
      "A": 1,
      "Q": 0.6366,
      "R": [
        30,
        30,
        30,
        30
      ],
      "U": [
        1,
        1,
        1,
        1
      ],
      "O": [
        1,
        1,
        1,
        1
      ],
      "L": [
        20,
        20,
        20,
        20
      ],
      "H": [
        20,
        20,
        20,
        20
      ],
      "J": [
        200,
        200,
        200,
        200
      ],
      "W": 0.01,
      "S": 20000,
      "I": [
        3,
        3,
        3,
        3
      ],
      "X": [
        170,
        170,
        170,
        170
      ],
      "Y": [
        528.3,
        528.3,
        528.3,
        398.9
      ],
      "C": [
        0,
        0,
        0,
        0
      ],
      "F": 0,
      "B": 0,
      "P": 0
    },
    "m666_adjusted_by_data_collector": {
      "M": 666,
      "A": 1,
      "Q": 0.6366,
      "R": [
        30,
        30,
        30,
        30
      ],
      "U": [
        1,
        1,
        1,
        1
      ],
      "O": [
        1,
        1,
        1,
        1
      ],
      "L": [
        20,
        20,
        20,
        20
      ],
      "H": [
        20,
        20,
        20,
        20
      ],
      "J": [
        200,
        200,
        200,
        200
      ],
      "W": 0.01,
      "S": 20000,
      "I": [
        3,
        3,
        3,
        3
      ],
      "X": [
        170,
        170,
        170,
        170
      ],
      "Y": [
        528.3,
        528.3,
        528.3,
        398.9
      ],
      "C": [
        0,
        0,
        0,
        0
      ],
      "F": 0,
      "B": 0,
      "P": 0
    },
    "m669": {
      "A": [
        0
      ],
      "B": [
        1645.45
      ],
      "C": [
        -1645.45
      ],
      "D": [
        0
      ],
      "P": []
    },
    "m92": {
      "X": [],
      "Y": [],
      "Z": [],
      "U": [],
      "E": []
    },
    "mm_per_degree": [
      0.5235987755982988,
      0.5235987755982988,
      0.5235987755982988,
      0.5235987755982988
    ],
    "notes": {
      "buildup_factor_forced": 0.636619,
      "base_radii_forced_mm": [
        30,
        30,
        30,
        30
      ]
    },
    "force_tuning": {
      "auto_tuned": true,
      "method": "force-thresholds",
      "tuned_at": "2026-03-23T19:45:37.415Z",
      "force_low_n": 0.017355279298559987,
      "force_mid_n": 0.3471055859711997,
      "force_max_n": 5.122546250527634,
      "active_anchor": 1,
      "fixed_anchor": 3,
      "rest_anchors": [
        0,
        2
      ],
      "idle_force_initial": 0.01,
      "idle_force_final": 0.017355279298559987,
      "force_start": 0.3471055859711997,
      "force_edge": 5.122546250527634,
      "force_cap": 20,
      "force_start_bracket_no": 0.2892546549759998,
      "force_start_bracket_yes": 0.40495651696639967,
      "d_max_deg": 1330.5176988731255,
      "edge_at_cap": false,
      "edge_reason": "plateau detected by successive-travel tolerance",
      "edge_saturation": {
        "lowForce": 5.122546250527634,
        "highForce": 7.171564750738687,
        "lowTravelDeg": 1247.5600000000002,
        "highTravelDeg": 1248.63,
        "relDiff": 0.0008569392053690334
      },
      "edge_fit": {
        "ok": true,
        "dMax": 1330.5176988731255,
        "k": 2,
        "x0": 0.27430379403799465,
        "rmse": 37.7869876583946,
        "nUsed": 10
      },
      "edge_samples": [
        {
          "force": 0.3471055859711997,
          "travelDeg": 1.5,
          "moved": false,
          "stalled": true
        },
        {
          "force": 0.4859478203596796,
          "travelDeg": 131.85,
          "moved": true,
          "stalled": false
        },
        {
          "force": 0.6803269485035514,
          "travelDeg": 311.37,
          "moved": true,
          "stalled": false
        },
        {
          "force": 0.9524577279049719,
          "travelDeg": 498.27,
          "moved": true,
          "stalled": false
        },
        {
          "force": 1.3334408190669604,
          "travelDeg": 672.38,
          "moved": true,
          "stalled": false
        },
        {
          "force": 1.8668171466937444,
          "travelDeg": 869.8299999999999,
          "moved": true,
          "stalled": false
        },
        {
          "force": 2.613544005371242,
          "travelDeg": 1064.71,
          "moved": true,
          "stalled": false
        },
        {
          "force": 3.6589616075197386,
          "travelDeg": 1220.5600000000002,
          "moved": true,
          "stalled": false
        },
        {
          "force": 5.122546250527634,
          "travelDeg": 1247.5600000000002,
          "moved": true,
          "stalled": false
        },
        {
          "force": 7.171564750738687,
          "travelDeg": 1248.63,
          "moved": true,
          "stalled": false
        }
      ],
      "noise_samples": 10,
      "noise_duration_ms": 100,
      "noise_sigma_deg": [
        0.006000000000000181,
        0.007000000000000775,
        0.007483314773548611,
        2.3283064365386963e-10
      ],
      "move_thresholds_deg": {
        "active": 0.5,
        "residual_active": 0.3,
        "residual_sum": 0.8,
        "other_by_anchor": {
          "0": 0.5,
          "2": 0.5
        }
      },
      "stall_speed_deg_per_sec": 2.1000000000002323,
      "stall_window_ms": 2500
    },
    "max_travel_mm": 492.11582841912434,
    "encoder_noise_origin_deg": [
      0.006000000000000181,
      0.007000000000000775,
      0.007483314773548611,
      2.3283064365386963e-10
    ],
    "encoder_noise_origin_mm": [
      0.003141592653589888,
      0.003665191429188497,
      0.003918254452846714,
      1.2190983993892996e-10
    ],
    "encoder_noise": {
      "method": "mad",
      "units": "deg",
      "sigma_floor_deg": 0.01,
      "min_samples": 10,
      "sample_count": 20,
      "sample_interval_ms": 25,
      "sample_rate_hz": 40
    }
  },
  "sweeps": [
    {
      "id": "sweep_001",
      "fixed_anchors": [
        0,
        3
      ],
      "fixed_lengths": [
        492.135725172597,
        0.015707963267948963
      ],
      "drive_anchor": 1,
      "sensor_anchor": 2,
      "drive_range": {
        "start": -548.5273133045338,
        "end": 438.14221943290045,
        "unit": "mm"
      },
      "data_points": [
        {
          "l_drive": -548.5273133045338,
          "l_sensor": 439.8491514413509,
          "timestamp_ms": 55169,
          "raw_angles_deg": [
            939.84,
            -1047.61,
            840.05,
            -0.04
          ],
          "drive_setpoint_mm": -548.4854254024859,
          "step_index": 0,
          "step_count": 10,
          "mu": [
            939.8399999999999,
            -1047.5875,
            840.0004999999998,
            -0.04450000000000001
          ],
          "sigma": [
            0,
            0,
            0,
            0
          ],
          "sample_count": 20,
          "sampling_hz": 25.70694087403599,
          "sample_duration_ms": 778,
          "l_drive_mu": -548.5155323320829,
          "l_sensor_mu": 439.8232333019587,
          "noise_warnings": [
            "sigma_below_floor"
          ]
        },
        {
          "l_drive": -515.257847103018,
          "l_sensor": 358.27246220313594,
          "timestamp_ms": 57081,
          "raw_angles_deg": [
            939.94,
            -984.07,
            684.25,
            0.06
          ],
          "drive_setpoint_mm": -515.2345760463246,
          "step_index": 1,
          "step_count": 10,
          "mu": [
            939.9400000000002,
            -984.0459999999999,
            684.2019999999999,
            0.06000000000000003
          ],
          "sigma": [
            0,
            0,
            0,
            0
          ],
          "sample_count": 20,
          "sampling_hz": 26.10966057441253,
          "sample_duration_ms": 766,
          "l_drive_mu": -515.2452807324036,
          "l_sensor_mu": 358.2473294619072,
          "noise_warnings": [
            "sigma_below_floor"
          ]
        },
        {
          "l_drive": -481.9569649749661,
          "l_sensor": 289.7124385262947,
          "timestamp_ms": 58966,
          "raw_angles_deg": [
            939.82,
            -920.47,
            553.31,
            0.06
          ],
          "drive_setpoint_mm": -481.98372669016334,
          "step_index": 2,
          "step_count": 10,
          "mu": [
            939.8199999999999,
            -920.4970000000001,
            553.3639999999999,
            0.05550000000000003
          ],
          "sigma": [
            0,
            0,
            0,
            0
          ],
          "sample_count": 20,
          "sampling_hz": 26.07561929595828,
          "sample_duration_ms": 767,
          "l_drive_mu": -481.9711021419073,
          "l_sensor_mu": 289.740712860177,
          "noise_warnings": [
            "sigma_below_floor"
          ]
        },
        {
          "l_drive": -448.76603858978996,
          "l_sensor": 231.04319572050534,
          "timestamp_ms": 60633,
          "raw_angles_deg": [
            939.93,
            -857.08,
            441.26,
            0.05
          ],
          "drive_setpoint_mm": -448.73287733400207,
          "step_index": 3,
          "step_count": 10,
          "mu": [
            939.9370000000002,
            -857.0380000000001,
            441.16900000000004,
            0.05700000000000003
          ],
          "sigma": [
            0,
            0,
            0,
            0
          ],
          "sample_count": 20,
          "sampling_hz": 26.041666666666668,